{
  "run": {
    "run_type": "daily",
    "started_at": "2026-10-29T09:55:00+01:00",
    "finished_at": "2026-10-29T10:10:00+01:00",
    "queries_run": [
      "CPR Asset Management stage 2027",
      "Crédit Mutuel Arkéa CIC Market Solutions stage mars 2027 finance de marché",
      "Direct Assurance stage 2027 data finance",
      "Amundi stage Assistant Securities Lending Trading 116870",
      "stage assistant trader mars 2027 Paris",
      "stage structuration mars 2027 Paris",
      "stage gestion de portefeuille assistant gérant mars 2027",
      "Safran stage assistant trader salle des marchés 2027"
    ],
    "sources_reached": [
      "Moteur de recherche web (WebSearch)",
      "Données de l'app : API Workday Ardian",
      "Données de l'app : alertes e-mail Indeed et Hellowork"
    ],
    "sources_inaccessible": [
      "casa-amundi-recrute.talent-soft.com (ENOTFOUND)",
      "group.bnpparibas (ENOTFOUND)",
      "www.safran-group.com (ENOTFOUND)"
    ]
  },
  "listings": [
    {
      "Country": "France",
      "Requisition_ID": "JR1002130",
      "Publication_Date": "Unknown",
      "First_Discovered_Date": "2026-10-29",
      "Last_Verified_Date": "2026-10-29",
      "Application_Deadline": "Unknown",
      "Internship_Start_Date": "2027-03",
      "Internship_End_Date": "Unknown",
      "Duration_Months": "6",
      "Preferred_Skills": [],
      "Languages": [
        "Français (texte de l'offre)"
      ],
      "Preferred_Gaps": "Profil « première expérience en stage en … » tronqué dans le texte fourni : exigence exacte Unknown.",
      "Required_Skills": [
        "Qualités commerciales",
        "Rigueur",
        "Aisance relationnelle",
        "Travail d'équipe"
      ],
      "Responsibilities": [
        "Organisation et suivi des étapes de lancement des syndications",
        "Collecte et revue des documents de souscription avec juridique, compliance, finance",
        "Préparation des documents de suivi et supervision des closings",
        "Rapport mensuel de syndication au Comex",
        "Mise à jour de la base de données consolidée des syndications"
      ],
      "Employer": "Ardian",
      "Job_Title": "Investor Relations Syndication Stage - Mars 2027 | Paris (M/F)",
      "Job_Family": "Private Equity / Private Debt",
      "Location": "Paris",
      "Source": "Site carrières officiel (API Workday Ardian, collecte de l'app)",
      "Job_URL": "https://ardian.wd103.myworkdayjobs.com/ArdianCareers/job/Paris/Investor-Relations-Syndication-Stage---Mars-2027---Paris--M-F-_JR1002130",
      "Eligibility_Status": "Likely eligible",
      "Core_Requirements_Met": "Partly",
      "Main_Strengths": "Dernière année d'école d'ingénieur (ENSEIRB-MATMECA) explicitement acceptée ; début mars 2027, 6 mois, Paris ; expérience de bases de données, reportings et dashboards (SG : Power BI ; LabData : Python/SQL) utile pour la base consolidée des syndications et le rapport mensuel au Comex.",
      "Essential_Gaps": "« Excellentes qualités commerciales » sans preuve directe dans les CV ; aucune expérience en relations investisseurs, co-investissement ou documentation juridique de fonds.",
      "Fit_Explanation": "Rôle de coordination et de reporting (syndication, closings, base de données, rapport Comex) au sein d'un grand acteur du private equity : bon calendrier et bonne éligibilité, mais peu de contenu quantitatif ou d'investissement ; porte d'entrée vers le PE plutôt que poste d'analyse.",
      "Verification_Status": "Verified active",
      "Notes": "Offre déjà connue (J-50E99B5C, Discovered) : réévaluée à partir du texte fourni par l'app, aucun changement de statut. Texte de l'offre tronqué après « Une première expérience en stage en ». Score = priorisation interne, pas une probabilité d'embauche.",
      "Next_Action": "Décider s'il vaut la peine de candidater (rôle peu quantitatif) ; si oui, adapter un CV orienté reporting / bases de données avec ats-cv-optimizer.",
      "Recommended_CV_Version": "Version FR famille Private Equity / Private Debt (04_Applications/00_Versions_par_famille/)",
      "Score_Breakdown": {
        "role": {
          "points": 11,
          "evidence": "Missions : suivi et coordination des syndications, collecte et revue des documents de souscription, suivi des closings, rapport mensuel au Comex, mise à jour de la base consolidée. Recoupe le reporting et la gestion de données (SG, LabData), pas l'analyse d'investissement."
        },
        "tech": {
          "points": 12,
          "evidence": "Compétences demandées : qualités commerciales, rigueur, aisance relationnelle, travail d'équipe. Aucun outil quantitatif demandé ; Python/SQL/Power BI d'Ihab utiles pour la base de données mais non requis."
        },
        "academic": {
          "points": 13,
          "evidence": "« Étudiant en dernière année d'École de Commerce ou d'Ingénieur ou année de césure » : Ihab est en dernière année ENSEIRB-MATMECA + M2 IREF. Exigence d'expérience tronquée (Unknown)."
        },
        "career": {
          "points": 9,
          "evidence": "Private equity (cible cœur B) mais fonction relations investisseurs / syndication, non investissement : alignement intermédiaire."
        },
        "duration": {
          "points": 10,
          "evidence": "« Durée du stage : 6 mois », « Début : Mars 2027 » : compatible avec 1er mars – 31 août 2027."
        },
        "location": {
          "points": 10,
          "evidence": "Paris = Île-de-France ; langue non précisée dans le texte fourni (texte en français)."
        }
      },
      "Match_Score": "65",
      "Priority": "Worth applying"
    },
    {
      "Country": "France",
      "Requisition_ID": "Unknown",
      "Publication_Date": "Unknown",
      "First_Discovered_Date": "2026-10-29",
      "Last_Verified_Date": "2026-10-29",
      "Application_Deadline": "Unknown",
      "Internship_Start_Date": "Unknown",
      "Internship_End_Date": "Unknown",
      "Duration_Months": "6",
      "Preferred_Skills": [],
      "Languages": [],
      "Preferred_Gaps": "Unknown",
      "Required_Skills": [],
      "Responsibilities": [],
      "Employer": "Ostrum Asset Management",
      "Job_Title": "Stage - 6 mois - Stratégiste ESG F/H",
      "Job_Family": "Asset Management / Portfolio Analytics",
      "Location": "Paris (75)",
      "Source": "Alerte e-mail Indeed",
      "Job_URL": "https://fr.indeed.com/viewjob?jk=0ec872e8d3c416d1",
      "Eligibility_Status": "Unclear",
      "Core_Requirements_Met": "Unknown",
      "Main_Strengths": "Société de gestion (cible cœur B, affiliée Natixis IM) ; Paris ; 6 mois ; formation M2 finance quantitative.",
      "Essential_Gaps": "Exigences inconnues (seul l'extrait de l'alerte est disponible) ; aucune expérience ESG dans les CV.",
      "Fit_Explanation": "Stage de recherche / stratégie ESG en gestion d'actifs : famille cible, mais contenu exact, début et profil inconnus tant que la page officielle n'est pas lue.",
      "Verification_Status": "Unverified",
      "Notes": "Vu dans l'alerte Indeed du 2026-10-28 (« il y a 1 jour »). Page officielle non recherchée (budget). Score = priorisation interne, pas une probabilité d'embauche.",
      "Next_Action": "Trouver la page officielle (recrutement.bpce.fr / Natixis IM) pour vérifier début, profil et missions.",
      "Recommended_CV_Version": "Version FR famille Asset Management (04_Applications/00_Versions_par_famille/)",
      "Score_Breakdown": {
        "role": {
          "points": 12,
          "evidence": "Intitulé « Stratégiste ESG » en société de gestion ; extrait de l'alerte sans description des missions."
        },
        "tech": {
          "points": 12,
          "evidence": "Aucune compétence listée dans l'extrait : évaluation neutre faute de données."
        },
        "academic": {
          "points": 10,
          "evidence": "Niveau d'études non précisé dans l'extrait (Unknown)."
        },
        "career": {
          "points": 12,
          "evidence": "Gestion d'actifs (cœur B), mais stratégie ESG plutôt que gestion de portefeuille ou recherche quantitative."
        },
        "duration": {
          "points": 7,
          "evidence": "« 6 mois » dans l'intitulé ; date de début Unknown."
        },
        "location": {
          "points": 10,
          "evidence": "Paris (75) ; langues Unknown."
        }
      },
      "Match_Score": "63",
      "Priority": "Stretch opportunity"
    },
    {
      "Country": "France",
      "Requisition_ID": "Unknown",
      "Publication_Date": "Unknown",
      "First_Discovered_Date": "2026-10-29",
      "Last_Verified_Date": "2026-10-29",
      "Application_Deadline": "Unknown",
      "Internship_Start_Date": "Unknown",
      "Internship_End_Date": "Unknown",
      "Duration_Months": "Unknown",
      "Preferred_Skills": [],
      "Languages": [],
      "Preferred_Gaps": "Unknown",
      "Required_Skills": [],
      "Responsibilities": [],
      "Employer": "BNP Paribas",
      "Job_Title": "Stage - Data Scientist ALMT Digital Innovations & AI - H/F",
      "Job_Family": "Capital Markets Data / Python",
      "Location": "Paris (75)",
      "Source": "Alerte e-mail Indeed",
      "Job_URL": "https://fr.indeed.com/viewjob?jk=4dac6207970d970a",
      "Eligibility_Status": "Unclear",
      "Core_Requirements_Met": "Partly",
      "Main_Strengths": "Projet RAG Chatbot (LangChain, embeddings, LLM open source, prototype) et Python professionnel (SG, Inside Therapeutics) ; animation d'un workshop IA interne.",
      "Essential_Gaps": "Aucune expérience professionnelle en IA générative ni en ALM / trésorerie ; exigences exactes inconnues.",
      "Fit_Explanation": "Cas d'usage IA générative / LLM / IA agentique pour l'ALM Treasury de BNP Paribas : très bon recoupement technique, mais famille secondaire (data & IA en finance).",
      "Verification_Status": "Unverified",